{
  "horse_id": "415428",
  "horse": "example-value",
  "sp": "example-value",
  "sp_dec": "example-value",
  "number": "example-value",
  "position": "example-value",
  "draw": "example-value",
  "btn": "example-value",
  "ovr_btn": "example-value",
  "age": "example-value",
  "sex": "example-value",
  "weight": "example-value",
  "weight_lbs": "example-value",
  "headgear": "example-value",
  "time": "example-value",
  "or": "example-value",
  "rpr": "example-value",
  "tsr": "example-value",
  "prize": "example-value",
  "jockey": "example-value",
  "jockey_claim_lbs": "0",
  "jockey_id": "648705",
  "trainer": "example-value",
  "trainer_id": "820413",
  "owner": "example-value",
  "owner_id": "196557",
  "sire": "example-value",
  "sire_id": "196137",
  "dam": "example-value",
  "dam_id": "514489",
  "damsire": "example-value",
  "damsire_id": "150875",
  "comment": "example-value",
  "silk_url": ""
}